{
 "schema": "sav2x.sample.vehicle/2.0",
 "sample_id": "base_s1_f2_N_right.5_3316",
 "origin": "sim",
 "scenario": "base",
 "run_id": "base_s1",
 "seed": 1,
 "intersection_id": 7,
 "map_version": "7:1",
 "target_crosswalk_id": ":C_c0",
 "target_signal_group": 21,
 "crosswalk_length_m": 12.8,
 "t0_ms": 1791381931600,
 "dt_ms": 100,
 "n_hist": 30,
 "n_fut": 80,
 "label_horizon_s": 20.0,
 "bin_s": 0.5,
 "ego": {
  "temp_id": "9667375e",
  "length_m": 4.7,
  "width_m": 1.8,
  "hist_fields": ["x_m", "y_m", "speed_mps", "heading_deg", "accel_long_mps2", "yaw_rate_dps", "brake_applied", "left_turn", "right_turn", "path_radius_m", "pos_acc_m", "valid"],
  "hist": [
   [-4.98, 78.12, 13.58, 179.45, -0.29, 0.0, 0, 0, 0, 3276.7, 1.4, 1],
   [-5.01, 76.62, 13.62, 179.875, -0.32, 0.0, 0, 0, 0, 3276.7, 1.4, 1],
   [-5.02, 75.3, 13.6, 180.113, -0.1, 0.0, 0, 0, 0, 3276.7, 1.4, 1],
   [-4.85, 73.81, 13.68, 179.475, 0.18, 0.0, 0, 0, 0, 3276.7, 1.4, 1],
   [-4.99, 72.43, 13.6, 179.587, -0.85, 0.0, 0, 0, 0, 3276.7, 1.4, 1],
   [-5.13, 71.23, 13.6, 180.837, 0.23, 0.0, 0, 0, 0, 3276.7, 1.4, 1],
   [-4.9, 69.7, 13.68, 180.8, -0.19, 0.0, 0, 0, 0, 3276.7, 1.4, 1],
   [-4.91, 68.51, 13.62, 179.8, 0.53, 0.0, 0, 0, 0, 3276.7, 1.4, 1],
   [-4.79, 67.21, 13.66, 180.637, -0.67, 0.0, 0, 0, 0, 3276.7, 1.4, 1],
   [-5.04, 65.94, 13.56, 179.812, -0.05, 0.0, 0, 0, 0, 3276.7, 1.4, 1],
   [-4.94, 64.6, 13.54, 181.3, 0.08, 0.0, 0, 0, 0, 3276.7, 1.4, 1],
   [-4.91, 62.93, 13.7, 179.238, 0.69, 0.0, 0, 0, 0, 3276.7, 1.4, 1],
   [-5.08, 61.84, 13.6, 179.625, -0.68, 0.0, 0, 0, 0, 3276.7, 1.4, 1],
   [-5.08, 60.42, 13.52, 180.087, 0.2, 0.0, 0, 0, 0, 3276.7, 1.4, 1],
   [-4.84, 59.05, 13.66, 179.938, -0.43, 0.0, 0, 0, 0, 3276.7, 1.4, 1],
   [-4.77, 57.45, 13.6, 179.225, 0.26, 0.0, 0, 0, 0, 3276.7, 1.4, 1],
   [-4.9, 56.4, 13.58, 180.087, -0.4, 0.0, 0, 0, 0, 3276.7, 1.4, 1],
   [-4.94, 55.19, 13.58, 180.4, 0.85, 0.0, 0, 0, 0, 3276.7, 1.4, 1],
   [-5.08, 53.77, 13.6, 179.863, 0.13, 0.0, 0, 0, 0, 3276.7, 1.4, 1],
   [-4.96, 52.25, 13.62, 179.538, 0.08, 0.0, 0, 0, 0, 3276.7, 1.4, 1],
   [-4.94, 50.9, 13.6, 180.387, -0.95, 0.0, 0, 0, 0, 3276.7, 1.4, 1],
   [-4.88, 49.43, 13.56, 179.9, -0.43, 0.0, 0, 0, 0, 3276.7, 1.4, 1],
   [-4.85, 48.15, 13.66, 180.25, 0.38, 0.0, 0, 0, 0, 3276.7, 1.4, 1],
   [-5.18, 46.69, 13.64, 180.375, -0.5, 0.0, 0, 0, 0, 3276.7, 1.4, 1],
   [-5.04, 45.15, 13.4, 180.087, -0.33, 0.0, 0, 0, 0, 3276.7, 1.4, 1],
   [-5.04, 44.02, 13.52, 179.788, 0.13, 0.0, 0, 0, 0, 3276.7, 1.4, 1],
   [-5.06, 42.63, 13.7, 178.938, 0.8, 0.0, 0, 0, 0, 3276.7, 1.4, 1],
   [-4.97, 41.36, 13.6, 178.8, -1.0, 0.0, 0, 0, 0, 3276.7, 1.4, 1],
   [-4.93, 39.87, 13.72, 179.712, 0.79, 0.0, 0, 0, 0, 3276.7, 1.4, 1],
   [-5.02, 38.78, 13.64, 179.762, 0.01, 0.0, 0, 0, 0, 3276.7, 1.4, 1]
  ],
  "map_match": {
   "lane_id": "N_in_1",
   "role": "ingress",
   "approach": "N",
   "s_m": 261.22,
   "lat_m": 0.22,
   "dist_to_stopline_m": 28.38
  }
 },
 "routes": [
  {
   "maneuver": "left",
   "connection_id": "N_in_2>E_out_2",
   "signal_group": 1,
   "lane_change": true,
   "crosses_target": true,
   "zones": ["inbound"],
   "s_stopline_m": 28.38,
   "s_cw_entry_m": 28.38,
   "s_cw_exit_m": 32.421,
   "path_spacing_m": 4.0,
   "path": [
    [-1.6, 38.78],
    [-1.6, 34.78],
    [-1.6, 30.78],
    [-1.6, 26.78],
    [-1.6, 22.78],
    [-1.6, 18.78],
    [-1.6, 14.78],
    [-1.6, 10.78],
    [-1.087, 6.817],
    [0.342, 3.163],
    [3.067, 0.4],
    [6.704, -1.072],
    [10.667, -1.6],
    [14.667, -1.6],
    [18.667, -1.6],
    [22.667, -1.6],
    [26.667, -1.6],
    [30.667, -1.6],
    [34.667, -1.6],
    [38.667, -1.6],
    [42.667, -1.6],
    [46.667, -1.6],
    [50.667, -1.6],
    [54.667, -1.6],
    [58.667, -1.6],
    [62.667, -1.6],
    [66.667, -1.6],
    [70.667, -1.6],
    [74.667, -1.6],
    [78.667, -1.6],
    [82.667, -1.6]
   ]
  },
  {
   "maneuver": "straight",
   "connection_id": "N_in_1>S_out_1",
   "signal_group": 2,
   "lane_change": false,
   "crosses_target": true,
   "zones": ["inbound"],
   "s_stopline_m": 28.38,
   "s_cw_entry_m": 28.38,
   "s_cw_exit_m": 32.38,
   "path_spacing_m": 4.0,
   "path": [
    [-4.8, 38.78],
    [-4.8, 34.78],
    [-4.8, 30.78],
    [-4.8, 26.78],
    [-4.8, 22.78],
    [-4.8, 18.78],
    [-4.8, 14.78],
    [-4.8, 10.78],
    [-4.8, 6.78],
    [-4.8, 2.78],
    [-4.8, -1.22],
    [-4.8, -5.22],
    [-4.8, -9.22],
    [-4.8, -13.22],
    [-4.8, -17.22],
    [-4.8, -21.22],
    [-4.8, -25.22],
    [-4.8, -29.22],
    [-4.8, -33.22],
    [-4.8, -37.22],
    [-4.8, -41.22],
    [-4.8, -45.22],
    [-4.8, -49.22],
    [-4.8, -53.22],
    [-4.8, -57.22],
    [-4.8, -61.22],
    [-4.8, -65.22],
    [-4.8, -69.22],
    [-4.8, -73.22],
    [-4.8, -77.22],
    [-4.8, -81.22]
   ]
  },
  {
   "maneuver": "right",
   "connection_id": "N_in_1>W_out_1",
   "signal_group": 3,
   "lane_change": false,
   "crosses_target": true,
   "zones": ["inbound"],
   "s_stopline_m": 28.38,
   "s_cw_entry_m": 28.38,
   "s_cw_exit_m": 32.662,
   "path_spacing_m": 4.0,
   "path": [
    [-4.8, 38.78],
    [-4.8, 34.78],
    [-4.8, 30.78],
    [-4.8, 26.78],
    [-4.8, 22.78],
    [-4.8, 18.78],
    [-4.8, 14.78],
    [-4.8, 10.78],
    [-5.739, 6.968],
    [-9.003, 5.0],
    [-12.989, 4.8],
    [-16.989, 4.8],
    [-20.989, 4.8],
    [-24.989, 4.8],
    [-28.989, 4.8],
    [-32.989, 4.8],
    [-36.989, 4.8],
    [-40.989, 4.8],
    [-44.989, 4.8],
    [-48.989, 4.8],
    [-52.989, 4.8],
    [-56.989, 4.8],
    [-60.989, 4.8],
    [-64.989, 4.8],
    [-68.989, 4.8],
    [-72.989, 4.8],
    [-76.989, 4.8],
    [-80.989, 4.8],
    [-84.989, 4.8],
    [-88.989, 4.8],
    [-92.989, 4.8]
   ]
  }
 ],
 "signals": {
  "spat_age_s": 0.09,
  "groups": [
   {
    "signal_group": 1,
    "kind": "vehicle",
    "state": "stop-And-Remain",
    "min_end_s": 15.9,
    "likely_end_s": 24.4,
    "max_end_s": 32.4,
    "conf_p": 0.56,
    "elapsed_s": 24.5,
    "timing_valid": true
   },
   {
    "signal_group": 2,
    "kind": "vehicle",
    "state": "stop-And-Remain",
    "min_end_s": 15.9,
    "likely_end_s": 24.4,
    "max_end_s": 32.4,
    "conf_p": 0.56,
    "elapsed_s": 24.5,
    "timing_valid": true
   },
   {
    "signal_group": 3,
    "kind": "vehicle",
    "state": "stop-Then-Proceed",
    "min_end_s": 14.9,
    "likely_end_s": 23.4,
    "max_end_s": 31.4,
    "conf_p": 0.56,
    "elapsed_s": 23.5,
    "timing_valid": true
   },
   {
    "signal_group": 21,
    "kind": "pedestrian",
    "state": "protected-Movement-Allowed",
    "min_end_s": -0.1,
    "likely_end_s": 8.4,
    "max_end_s": 16.4,
    "conf_p": 0.56,
    "elapsed_s": 23.5,
    "timing_valid": true
   }
  ],
  "ped_bicycle_detect": true
 },
 "ped_presence": {
  "zones": ["wait_in", "cw_1", "cw_2", "cw_3", "cw_4", "wait_out"],
  "count": [
   [0, 0, 1, 0, 0, 0],
   [0, 0, 1, 0, 0, 0],
   [0, 0, 1, 0, 0, 0],
   [0, 0, 1, 0, 0, 0],
   [0, 0, 1, 0, 0, 0],
   [0, 0, 1, 0, 0, 0],
   [0, 0, 0, 1, 0, 0],
   [0, 0, 1, 0, 0, 0],
   [0, 0, 0, 1, 0, 0],
   [0, 0, 0, 1, 0, 0],
   [0, 0, 0, 1, 0, 0],
   [0, 0, 0, 1, 0, 0],
   [0, 0, 0, 1, 0, 0],
   [0, 0, 0, 1, 0, 0],
   [0, 0, 0, 1, 0, 0],
   [0, 0, 0, 1, 0, 0],
   [0, 0, 0, 1, 0, 0],
   [0, 0, 0, 1, 0, 0],
   [0, 0, 0, 1, 0, 0],
   [0, 0, 0, 1, 0, 0],
   [0, 0, 0, 1, 0, 0],
   [0, 0, 0, 1, 0, 0],
   [0, 0, 0, 1, 0, 0],
   [0, 0, 0, 1, 0, 0],
   [0, 0, 0, 1, 0, 0],
   [0, 0, 0, 1, 0, 0],
   [0, 0, 0, 1, 1, 0],
   [0, 0, 0, 1, 1, 0],
   [0, 0, 0, 1, 1, 0],
   [0, 0, 0, 1, 1, 0]
  ],
  "valid": [1, 1, 1, 1, 1, 1, 1, 1, 1, 1, 1, 1, 1, 1, 1, 1, 1, 1, 1, 1, 1, 1, 1, 1, 1, 1, 1, 1, 1, 1],
  "sdsm_age_s": 0.2
 },
 "leader_bsm": {
  "present": false
 },
 "labels": {
  "truth_id": "f2_N_right.5",
  "fut": [
   [-4.8, 37.643, 13.631, 1],
   [-4.8, 36.289, 13.541, 1],
   [-4.8, 34.933, 13.551, 1],
   [-4.8, 33.586, 13.48, 1],
   [-4.8, 32.281, 13.049, 1],
   [-4.8, 31.018, 12.628, 1],
   [-4.8, 29.8, 12.178, 1],
   [-4.8, 28.627, 11.728, 1],
   [-4.8, 27.499, 11.278, 1],
   [-4.8, 26.414, 10.856, 1],
   [-4.8, 25.373, 10.406, 1],
   [-4.8, 24.377, 9.956, 1],
   [-4.8, 23.427, 9.506, 1],
   [-4.8, 22.517, 9.099, 1],
   [-4.8, 21.652, 8.649, 1],
   [-4.8, 20.832, 8.199, 1],
   [-4.8, 20.057, 7.749, 1],
   [-4.8, 19.327, 7.299, 1],
   [-4.8, 18.642, 6.849, 1],
   [-4.8, 18.003, 6.399, 1],
   [-4.8, 17.408, 5.949, 1],
   [-4.8, 16.858, 5.499, 1],
   [-4.8, 16.352, 5.061, 1],
   [-4.8, 15.891, 4.611, 1],
   [-4.8, 15.475, 4.161, 1],
   [-4.8, 15.104, 3.711, 1],
   [-4.8, 14.778, 3.261, 1],
   [-4.8, 14.497, 2.811, 1],
   [-4.8, 14.26, 2.361, 1],
   [-4.8, 14.069, 1.911, 1],
   [-4.8, 13.923, 1.461, 1],
   [-4.8, 13.822, 1.019, 1],
   [-4.8, 13.765, 0.569, 1],
   [-4.8, 13.751, 0.134, 1],
   [-4.8, 13.751, 0.002, 1],
   [-4.8, 13.751, 0.0, 1],
   [-4.8, 13.751, 0.0, 1],
   [-4.8, 13.751, 0.0, 1],
   [-4.8, 13.751, 0.0, 1],
   [-4.8, 13.751, 0.0, 1],
   [-4.8, 13.751, 0.0, 1],
   [-4.8, 13.751, 0.0, 1],
   [-4.8, 13.751, 0.0, 1],
   [-4.8, 13.751, 0.0, 1],
   [-4.8, 13.751, 0.0, 1],
   [-4.8, 13.751, 0.0, 1],
   [-4.8, 13.751, 0.0, 1],
   [-4.8, 13.751, 0.0, 1],
   [-4.8, 13.751, 0.0, 1],
   [-4.8, 13.751, 0.0, 1],
   [-4.8, 13.751, 0.0, 1],
   [-4.8, 13.751, 0.0, 1],
   [-4.8, 13.751, 0.0, 1],
   [-4.8, 13.751, 0.0, 1],
   [-4.8, 13.751, 0.0, 1],
   [-4.8, 13.751, 0.0, 1],
   [-4.8, 13.751, 0.0, 1],
   [-4.8, 13.751, 0.0, 1],
   [-4.8, 13.751, 0.0, 1],
   [-4.8, 13.751, 0.0, 1],
   [-4.8, 13.751, 0.0, 1],
   [-4.8, 13.751, 0.0, 1],
   [-4.8, 13.751, 0.0, 1],
   [-4.8, 13.751, 0.0, 1],
   [-4.8, 13.751, 0.0, 1],
   [-4.8, 13.751, 0.0, 1],
   [-4.8, 13.751, 0.0, 1],
   [-4.8, 13.751, 0.0, 1],
   [-4.8, 13.751, 0.0, 1],
   [-4.8, 13.751, 0.0, 1],
   [-4.8, 13.751, 0.0, 1],
   [-4.8, 13.751, 0.0, 1],
   [-4.8, 13.751, 0.0, 1],
   [-4.8, 13.751, 0.0, 1],
   [-4.8, 13.751, 0.0, 1],
   [-4.8, 13.751, 0.0, 1],
   [-4.8, 13.751, 0.0, 1],
   [-4.8, 13.751, 0.0, 1],
   [-4.8, 13.751, 0.0, 1],
   [-4.8, 13.751, 0.0, 1]
  ],
  "maneuver": "right",
  "crosses_target": true,
  "cw": {